{
  "version": "1.0.0",
  "updated_at": "2026-09-21T19:15:00Z",
  "total_projects": 55,
  "categories": [
    {
      "id": "gaql-reporting",
      "number": 1,
      "name": "Query and report with GAQL",
      "slug": "1-query-and-report-with-gaql",
      "description": "High-throughput SearchStream pipelines, dynamic schema reflection, and lightweight proxies for executing GAQL queries.",
      "count": 13,
      "subcategories": [
        {
          "name": "Official DevRel gateways and gRPC SearchStream pipelines",
          "slug": "official-devrel-gateways-and-grpc-searchstream-pipelines",
          "description": "Official Google implementations and high-throughput gRPC streaming servers with full protobuf serialization.",
          "count": 2,
          "tool_slugs": [
            "googleads-google-ads-mcp",
            "binarcode-google-ads-mcp-http"
          ]
        },
        {
          "name": "Dynamic schema reflection and field discovery",
          "slug": "dynamic-schema-reflection-and-field-discovery",
          "description": "Minimalist reflection servers querying GoogleAdsFieldService at runtime to eliminate schema drift and token bloat.",
          "count": 3,
          "tool_slugs": [
            "thainajardim-google-ads-mcp",
            "davidmosiah-google-ads-mcp-unofficial",
            "yeswanthreddyk-google-ads-mcp"
          ]
        },
        {
          "name": "Zero-SDK lean REST and minimal GAQL execution",
          "slug": "zero-sdk-lean-rest-and-minimal-gaql-execution",
          "description": "Lightweight proxies bypassing heavy SDK binaries in favor of direct HTTP calls, raw JSON, and compact GAQL responses.",
          "count": 4,
          "tool_slugs": [
            "cohnen-mcp-google-ads",
            "x777-mcp-google-ads",
            "afzalalisolangi-googleads-mcp-server",
            "minholi-google-ads-mcp"
          ]
        },
        {
          "name": "Edge runtimes and compiled native proxies",
          "slug": "edge-runtimes-and-compiled-native-proxies",
          "description": "Compiled Rust and high-performance TypeScript servers designed for serverless, low-memory, and edge execution.",
          "count": 4,
          "tool_slugs": [
            "fgribreau-mcp-google-ads",
            "lazare-42-google-ads-mcp",
            "kiarashedraki-google-ads-mcp",
            "cristiandrei1234-google-ads-mcp"
          ]
        }
      ]
    },
    {
      "id": "local-persistence",
      "number": 2,
      "name": "Persist data locally and query with SQL",
      "slug": "2-persist-data-locally-and-query-with-sql",
      "description": "Embedded SQLite databases and background ingestion workers enabling sub-5ms SQL analytics with zero API quota consumption.",
      "count": 5,
      "subcategories": [
        {
          "name": "Embedded SQLite data warehouses with background workers",
          "slug": "embedded-sqlite-data-warehouses-with-background-workers",
          "description": "Meta-MCP architectures running local SQLite WAL engines that synchronize account telemetry and execute multi-table joins.",
          "count": 2,
          "tool_slugs": [
            "klosk-adloop",
            "akelaonline-mcp-google-ads"
          ]
        },
        {
          "name": "Local campaign snapshot and zero-quota analytical caches",
          "slug": "local-campaign-snapshot-and-zero-quota-analytical-caches",
          "description": "Cached snapshot proxies enabling offline analytical queries and historical performance reporting without API rate limits.",
          "count": 3,
          "tool_slugs": [
            "atlasbarinc-google-ads-mcp",
            "mharnett-mcp-google-ads",
            "lucassantana-dev-google-ads-mcp"
          ]
        }
      ]
    },
    {
      "id": "campaign-mutations",
      "number": 3,
      "name": "Automate campaign mutations, budgets, and bid strategies",
      "slug": "3-automate-campaign-mutations-budgets-and-bid-strategies",
      "description": "Tools capable of modifying live accounts\u2014adjusting budgets, pausing ad groups, applying recommendations, and managing keyword lists.",
      "count": 10,
      "subcategories": [
        {
          "name": "Direct REST campaign mutation and bid/budget setters",
          "slug": "direct-rest-campaign-mutation-and-bidbudget-setters",
          "description": "Servers providing direct write endpoints for modifying campaign budgets, pausing ad groups, and adjusting bid amounts.",
          "count": 3,
          "tool_slugs": [
            "saifshabsug-google-ads-mcp-pro",
            "grantweston-google-ads-mcp-complete",
            "promobase-google-ads-mcp"
          ]
        },
        {
          "name": "Validated campaign CRUD with dry-run mutation guards",
          "slug": "validated-campaign-crud-with-dry-run-mutation-guards",
          "description": "Mutation suites enforcing validate_only dry-run preflights and parameter checks before committing live changes.",
          "count": 4,
          "tool_slugs": [
            "epave-google-ads-mcp",
            "rgellis-google-ads-mcp",
            "abdulrhmanalhur-google-ads-mcp",
            "matheusslg-google-ads-mcp"
          ]
        },
        {
          "name": "Keyword Planner and RLSA audience targeting suites",
          "slug": "keyword-planner-and-rlsa-audience-targeting-suites",
          "description": "Specialized keyword generation, negative keyword list management, and audience targeting automation tools.",
          "count": 3,
          "tool_slugs": [
            "konradbachowski-google-ads-mcp",
            "growmedevelopment-google-ads-mcp",
            "ball2jh-google-ads-mcp"
          ]
        }
      ]
    },
    {
      "id": "mutation-safety-ui",
      "number": 4,
      "name": "Enforce mutation safety with visual MCP Apps and human approval",
      "slug": "4-enforce-mutation-safety-with-visual-mcp-apps-and-human-approval",
      "description": "Interactive React widgets, spend sliders, and window.postMessage protocols that physically bypass the LLM on financial commit.",
      "count": 4,
      "subcategories": [
        {
          "name": "Interactive React widgets with window.postMessage commit bypass",
          "slug": "interactive-react-widgets-with-windowpostmessage-commit-bypass",
          "description": "Implementations of @modelcontextprotocol/ext-apps rendering sandboxed webviews for human approval before spend execution.",
          "count": 2,
          "tool_slugs": [
            "nowork-studio-notfair-plugin",
            "ameydabhade-google-ads-mcp"
          ]
        },
        {
          "name": "Spend protection sliders and physical budget modals",
          "slug": "spend-protection-sliders-and-physical-budget-modals",
          "description": "UI components featuring spend-cap sliders and visual guardrails to protect against accidental prompt-injection mutations.",
          "count": 2,
          "tool_slugs": [
            "monsieurgoodmood-google-ads-mcp-plus",
            "locomotive-agency-google-ads-mcp"
          ]
        }
      ]
    },
    {
      "id": "agency-mcc",
      "number": 5,
      "name": "Manage agency access and multi-account MCC hierarchies",
      "slug": "5-manage-agency-access-and-multi-account-mcc-hierarchies",
      "description": "Manager Account (MCC) hierarchies, multi-client routing, 60-minute OAuth token refresh daemons, and credential vaults.",
      "count": 10,
      "subcategories": [
        {
          "name": "Dynamic MCC switching via login-customer-id routing",
          "slug": "dynamic-mcc-switching-via-login-customer-id-routing",
          "description": "Servers enabling agency operators to seamlessly switch between hundreds of client accounts by injecting login-customer-id headers.",
          "count": 3,
          "tool_slugs": [
            "noordevtech-googleads-mcp",
            "trueclicks-google-ads-mcp-js",
            "connorcallison-google-ads-mcp"
          ]
        },
        {
          "name": "Proactive 60-minute OAuth token refresh daemons",
          "slug": "proactive-60-minute-oauth-token-refresh-daemons",
          "description": "Implementations that prevent the standard 3,600s Google OAuth session drop by running proactive background refresh loops.",
          "count": 3,
          "tool_slugs": [
            "gomarble-ai-google-ads-mcp-server",
            "connorstearns-mcp-google-ads",
            "johnoconnor0-google-ads-mcp"
          ]
        },
        {
          "name": "Multi-tenant credential vaults and agency proxies",
          "slug": "multi-tenant-credential-vaults-and-agency-proxies",
          "description": "Secure multi-client credential isolation and agency gateway proxies designed for enterprise PPC operations.",
          "count": 4,
          "tool_slugs": [
            "dhawalshah-google-ads-mcp",
            "abhibavishi-google-ads-mcp",
            "shivpanks19-mcp-google-ads",
            "videngrowth-public-google-ads-mcp"
          ]
        }
      ]
    },
    {
      "id": "domain-playbooks",
      "number": 6,
      "name": "Analyze performance with domain playbooks and heuristics",
      "slug": "6-analyze-performance-with-domain-playbooks-and-heuristics",
      "description": "AdTech domain reasoning engines enforcing conversion lag discounting, lost impression share attribution, and currency micros math.",
      "count": 4,
      "subcategories": [
        {
          "name": "Expert AdTech reasoning engines and conversion lag discounting",
          "slug": "expert-adtech-reasoning-engines-and-conversion-lag-discounting",
          "description": "Cognitive analytical engines embedding domain playbooks for 7-day conversion lag discounting and Bid-to-Position heuristics.",
          "count": 1,
          "tool_slugs": [
            "mathiaschu-google-ads-analyzer"
          ]
        },
        {